{
  "$schema": "http://json-schema.org/draft-07/schema#",
  "$id": "https://ai4ia/foundry/routine.schema.json",
  "title": "AI4IA Foundry routine manifest",
  "description": "Validation and planning contract for a proposed multi-step routine. scripts/provision-foundry-routine.py validates this design and prints its plan; it does not create or serve a Foundry routine because azure-ai-projects 2.8.0 exposes a trigger-to-existing-agent routine contract, not this steps-based shape. Nothing in this artifact is consumed by the app runtime.",
  "type": "object",
  "additionalProperties": false,
  "required": ["manifestVersion", "lifecycle", "owner", "sdkContract", "name", "description", "model", "steps"],
  "properties": {
    "$schema": { "type": "string" },
    "_comment": { "type": "string" },
    "manifestVersion": { "const": "1.0" },
    "lifecycle": {
      "const": "design-preview",
      "description": "Validated design artifact only; not provisioned or served."
    },
    "owner": { "type": "string", "minLength": 1 },
    "sdkContract": {
      "type": "object",
      "additionalProperties": false,
      "required": ["package", "version", "status", "surface"],
      "properties": {
        "package": { "const": "azure-ai-projects" },
        "version": { "const": "2.8.0" },
        "status": { "const": "not-executable" },
        "surface": { "const": "project.beta.routines.create_or_update" }
      }
    },
    "name": {
      "type": "string",
      "description": "Routine name (lowercase slug; same pattern as the toolbox name).",
      "pattern": "^[a-z][a-z0-9-]{0,38}[a-z0-9]$"
    },
    "description": {
      "type": "string",
      "description": "Human-readable routine description.",
      "minLength": 1,
      "maxLength": 512
    },
    "model": {
      "type": "string",
      "description": "Model deployment name the routine runs on (must exist in the project; AI4IA deploys these in foundry.bicep).",
      "minLength": 1
    },
    "toolbox": {
      "type": "string",
      "description": "Optional name of the toolbox namespace whose tool names this design references. A future runtime would still need to prove APIM-fronted dispatch; this field does not create or route calls.",
      "pattern": "^[a-z][a-z0-9-]{0,38}[a-z0-9]$"
    },
    "steps": {
      "type": "array",
      "description": "Ordered proposed workflow steps. At least one is required for a meaningful design.",
      "items": {
        "type": "object",
        "additionalProperties": false,
        "required": ["name", "instructions"],
        "properties": {
          "name": {
            "type": "string",
            "description": "Step name (unique within the routine).",
            "minLength": 1
          },
          "instructions": {
            "type": "string",
            "description": "What the model should do in this step.",
            "minLength": 1
          },
          "tools": {
            "type": "array",
            "description": "Canonical tool instance names from foundry/toolbox.manifest.json. Semantic validation rejects unknown names.",
            "items": { "type": "string", "minLength": 1 }
          }
        }
      }
    }
  }
}
