{
  "$schema": "./routine.schema.json",
  "_comment": "DESIGN-ONLY routine example. Tool names are cross-validated against the canonical toolbox namespace, but no routine runtime, APIM dispatch, or inherited governance path exists. Run scripts/provision-foundry-routine.py to validate and print the proposal. There is no --create because azure-ai-projects 2.8.0 exposes an incompatible trigger-to-agent routine model.",
  "manifestVersion": "1.0",
  "lifecycle": "design-preview",
  "owner": "repository-owner",
  "sdkContract": {
    "package": "azure-ai-projects",
    "version": "2.8.0",
    "status": "not-executable",
    "surface": "project.beta.routines.create_or_update"
  },
  "name": "research-brief",
  "description": "Proposed two-step research brief: gather grounded sources, then synthesize a cited summary. Future implementation must prove how named tools are routed and governed.",
  "model": "gpt-5.4",
  "toolbox": "ai4ia-toolbox",
  "steps": [
    {
      "name": "gather",
      "instructions": "Use web-search to collect authoritative sources for the user's question. Prefer primary and recent sources; record every URL.",
      "tools": ["web-search"]
    },
    {
      "name": "synthesize",
      "instructions": "Write a concise brief that answers the question. Cite every claim from the gathered sources using the citation format required by the consuming application.",
      "tools": ["code-interpreter"]
    }
  ]
}
